,id,text,date,attachments.link.url,attachments.link.title,comments.count,reposts.count,views.count
243,23479433,"Британский серфер Том Батлер, возможно, побил мировой рекорд. По предварительным оценкам, высота волны составила около тридцати метров. Если этот факт будет подтвержден, то Том станет мировым рекордсменом: https://ria.ru/20181219/1548268171.html",1545252963,,,30,21,65509
244,23479183,"Зависимость от соцсетей оказалась похожа на алкоголизм, заявляют ученые: https://ria.ru/20181219/1548250198.html",1545251378,,,99,31,69426
245,23478972,"В мистическом триллере ""Суспирия"", который сейчас показывают в российских кинотеатрах, одну из эпизодических ролей сыграла танцовщица и хореограф Елена Фокина, бывшая солистка камерного балета ""Москва"", уехавшая в начале нулевых в Европу. В интервью [club15755094|РИА Новости] она рассказала, как ей работалось на съемочной площадке с Тильдой Суинтон.",1545249900,https://ria.ru/20181219/1548201219.html,"""Фройляйн Иванова"": русская танцовщица — о съемках в фильме ""Суспирия""",14,1,56154
246,23478836,,1545249020,https://ria.ru/20181219/1548286209.html,У 101-летней москвички украли почти 300 тысяч рублей,75,7,60031
247,23478606,,1545247386,https://ria.ru/20181219/1548289399.html,Американские сенаторы призвали к операции против России в Черном море,361,24,70831
248,23478367,"#РИА_Видео
В мордовском поселке Комсомольский выпал серый снег. По словам местных жителей, причиной ""удивительных осадков"" могла стать авария на цементном заводе: https://ria.ru/20181219/1548270577.html",1545245852,,,37,11,61154
249,23478145,,1545244889,https://rsport.ria.ru/20181219/1548276402.html,В Аргентине футболист чуть не убил судью за красную карточку,35,2,63700
250,23478037,,1545244452,,,268,35,72283
251,23477651,"Под ограничения попали 18 россиян, 15 из которых являются сотрудниками ГРУ, и 4 компании. Кроме того, под санкциями оказались Анатолий Чепига и Александр Мишкин, которых на Западе подозревают в отравлении Скрипалей.",1545242615,https://ria.ru/20181219/1548288247.html,США расширили санкции против России,235,8,76366
252,23477370,,1545241225,https://ria.ru/20181219/1548286880.html,Еврокомиссия пригрозила Украине приостановкой безвиза,119,7,68428
253,23477088,"Подписанный указ снял установленные 20 лет назад ограничения, не позволявшие предоставлять убежище политическим беженцам. При этом решения в дальнейшем будут приниматься индивидуально.",1545239826,https://ria.ru/20181219/1548284801.html,Путин снял ограничения на предоставление политического убежища в России,220,21,75858
254,23476965,"#РИА_Видео
Зимние забавы по-сибирски. Мужчина в Южно-Енисейске прокатился на экскаваторе, как на карусели. Но и этого ему показалось мало. После катания в 37-градусный мороз сибиряк решил облиться ледяной водой ❄",1545239176,,,111,22,71421
255,23476757,#РИА_ФотоДня,1545238078,,,47,10,76170
256,23476291,,1545236053,https://ria.ru/20181219/1548274758.html,Ученые из России и Шотландии предложили новый метод борьбы с раком,85,11,67461
257,23476247,,1545235875,,,290,85,85355
258,23475920,,1545234741,https://ria.ru/20181219/1548280923.html,США начали выводить войска из Сирии,292,19,73175
259,23475775,"#РИА_Видео
В Челябинске создали ""самые русские конфеты"". За обычными на первый взгляд пельменями скрываются шоколадная оболочка и водочно-лимонная начинка! Чем не новый русский сувенир?",1545234091,,,80,36,75153
260,23475336,"Президент США отдал приказ полностью вывести войска из Сирии, сообщают СМИ.",1545232575,https://ria.ru/20181219/1548273870.html,Трамп объявил о победе над ИГ* в Сирии,381,7,75053
261,23475184,,1545232059,https://ria.ru/20181219/1548274640.html,В Подмосковье мужчину забили насмерть на кассе магазина,148,4,66491
262,23475023,"По словам местных жителей, причиной ""удивительных осадков"" могла стать авария на цементном заводе, расположенном в поселке.",1545231416,https://ria.ru/20181219/1548270577.html,В Мордовии выпал серый снег,61,7,62290
263,23474746,,1545230435,https://ria.ru/20181219/1548270036.html,В Финляндии установили стенды с именами погибших советских военнопленных,93,18,71240
264,23474624,,1545229996,,,71,61,74717
265,23474534,"Киев планирует осуществить новый проход украинских судов через Керченский пролив, сообщил Александр Турчинов.",1545229603,https://ria.ru/20181219/1548269079.html,Киев заявил о подготовке новой провокации в Керченском проливе,322,6,68010
266,23474352,"Тело обнаружили после того, как мужчина был вынужден покинуть предназначенный к сносу дом. Труп практически разложился. Отмечается, что мужчина пытался перебить запах освежителями воздуха.",1545228725,https://ria.ru/20181219/1548268805.html,Пожилой японец год прожил с трупом жены,61,2,65258
267,23473880,На трассе в Комсомольске-на-Амуре скорую помощь придавил трансформатор: https://ria.ru/20181219/1548259529.html,1545227072,,,76,8,70320
268,23473683,"Российский журналист кинул стакан в польского эксперта в эфире ""России 1"": https://ria.ru/20181219/1548264695.html",1545226467,,,490,23,89081
269,23473569,,1545225965,https://ria.ru/20181219/1548247779.html,Госдума приняла закон об отмене национального роуминга,81,29,67361
270,23473494,"Косуля попала под колеса автомобиля на Ленинградском проспекте в Кемерове. У нее закрытая травма головы и переломы двух ног. Местное общество защиты животных объявило сбор корма, сена и средств на лечение.",1545225600,https://m.vk.com/@-15755094-kemerovchane-podobrali-sbituu-v-cherte-goroda-kosulu,Кемеровчане подобрали сбитую в черте города косулю,74,8,86987
271,23473393,"Документ полностью запрещает умерщвление животных под каким бы то ни было предлогом, предусматривает создание спецприютов, запрещает бои с участием животных. Также вводится запрет на избавление от животных без передачи их новому владельцу и помещения в приют, вводится запрет на содержание животных в барах, ресторанах, пропаганду жестокого обращения с животными.",1545225141,https://ria.ru/20181219/1548250007.html,Госдума приняла закон об ответственном обращении с животными,395,149,91414
272,23473349,"#ПРЯМАЯТРАНСЛЯЦИЯ 
Еженедельный брифинг Марии Захаровой",1545224880,,,91,2,64129
273,23473237,,1545224324,https://rsport.ria.ru/20181219/1548257204.html,"Кокорин рассказал, какую книгу должен прочесть каждый россиянин",172,4,56221
274,23473005,"#РИА_Видео 
В одном из кафе Шанхая официантов можно погладить и угостить вкусняшкой! Еду в нем помогают заказать корги в футболках с QR-кодами 🐕",1545223068,,,34,36,74951
275,23472722,,1545221649,,,369,17,66758
276,23472679,,1545221369,https://ria.ru/20181219/1548256476.html,"Американские СМИ смоделировали ядерный удар подлодки ""Борей"" по США",104,5,60496
277,23472597,"Друзья, подписывайтесь на наши рассылки: 
- утреннюю, чтобы с самого начала дня быть в курсе актуальных новостей; 
- вечернюю, чтобы не пропустить главные темы дня;
- видео-рассылку, чтоб не пропускать самое интересное из разных уголков мира;
- ""Внимание, конкурс!"", чтоб не пропускать розыгрыши крутых призов✌🏻",1545220815,https://vk.com/ria?w=app5748831_-15755094,Рассылки от РИА Новости,8,0,53073
278,23472447,,1545219956,https://ria.ru/20181219/1548253261.html,"В ГИБДД рассказали, каким будет новый экзамен на водительские права",31,12,60106
279,23472211,"Месяца не прошло после нашумевшей истории, когда жильцы многоэтажного дома в московском районе Коньково потребовали выселения детей с онкологическими заболеваниями. Старшая по подъезду тогда заявила, что рак заразен, и начала сбор подписей. Однако выяснилось, что этот случай — не единичный. В другом доме собственники уже несколько лет третируют семьи, живущие в арендованной фондом ""Спаси жизнь"" квартире. Неоднократные жалобы участковому довели родителей онкобольных детей до того, что они сами решили уехать, лишь бы их не трогали.",1545218655,https://ria.ru/20181219/1548212253.html,Жильцы еще одной московской многоэтажки требуют выселить онкобольных детей,274,17,66558
280,23471925,"Городская навигация – симбиоз трех ""п"": простота, понятность и правдивость. Но даже в этих строгих рамках есть место креативности и свойскому диалогу с местными и туристами. Собрали оригинальные знаки и указатели, которые не только приведут туристов к достопримечательностям, но и откроют город с необычной стороны.",1545217216,https://realty.ria.ru/20181219/1548201489.html,Маршрут внезапно построен: приколы и тайны необычных городских знаков,10,7,56965
281,23471692,Появилось видео проезда Tesla по туннелю Маска под Лос-Анджелесом: https://ria.ru/20181219/1548246527.html,1545216358,,,159,14,75229
282,23471534,"#РИА_Видео 
19 декабря 1906 года родился Леонид Ильич Брежнев. На посту первого секретаря ЦК КПСС он пробыл свыше 18 лет. Период его правления получил название ""эпоха застоя"".",1545215692,,,189,41,80889
283,23471293,,1545214552,https://ria.ru/20181219/1548243108.html,В ЦБ рассказали о подорожании товаров в 2019 году,242,23,67522
284,23471153,"Около 600 миллионов человек в мире играет в сетевые онлайн-игры, из них 180 миллионов – игроки ""в танчики"". В новом эпизоде подкаста ""Как вы это делаете?!"" поговорили с Максимом Чуваловым - паблишинг директором в Wargaming.net. о WOT и игровой индустрии.

 Как пользователи могут провернуть свою маленькую виртуальную ""революцию"" и повлиять на разработку игр? Как женщины начинают играть в ""танки"" и почему российские и белорусские инженеры и разработчики – одни из лучших в мире? 
#каквыэтоделаете #риа_подкаст #wot #worldoftanks",1545213874,,,161,24,89622
285,23471048,,1545213486,https://rsport.ria.ru/20181219/1548244225.html,Мутко покидает пост президента РФС,144,5,61742
286,23470928,,1545212716,https://ria.ru/20181219/1548242539.html,"В московской больнице нашли тела людей, умерших более десяти лет назад",86,13,62779
287,23470775,"#РИАрхив 
74-й день рождения празднует актриса театра и кино, народная артистка РСФСР Анастасия Вертинская.",1545211704,,,43,22,67486
288,23470700,,1545211334,https://rsport.ria.ru/20181219/1548237656.html,Петербург поборется за право провести финал Лиги Чемпионов,66,11,61577
289,23470584,,1545210529,https://ria.ru/20181219/1548239719.html,"Госдума смягчила наказание ""за лайки и репосты""",113,13,63100
290,23470512,,1545209990,https://ria.ru/20181219/1548239583.html,"В Ставрополе уничтожили боевиков ИГ*, открывших огонь по силовикам",77,7,55057
291,23470384,В мурманской гимназии обрушилась часть навесного потолка: https://ria.ru/20181219/1548238175.html,1545209235,,,106,7,68881
292,23470269,"Год назад автобус въехал в толпу у станции метро ""Славянский бульвар"". В результате аварии четыре человека погибли, одиннадцать получили травмы.",1545208269,https://ria.ru/20181219/1548234143.html,"Суд признал виновным водителя автобуса, въехавшего в переход в Москве",42,4,60772
293,23470067,"Трое мужчин, один из которых — участковый, будучи нетрезвыми, жестоко избили и изнасиловали женщину.",1545206683,https://ria.ru/20181219/1548236101.html,В Иркутске арестовали трех мужчин за изнасилование в пункте полиции,110,7,62655
294,23469799,"Два года назад посол России в Турции Андрей Карлов выступал на открытии выставки в Анкаре. Стоявший сзади молодой человек с криком ""Аллах акбар!"" внезапно выхватил пистолет и выстрелил ему в спину. Супруга Карлова в этот момент была рядом.",1545205253,https://ria.ru/20181219/1548178858.html,"Вдова Андрея Карлова рассказала, как живет после трагедии",51,7,61544
295,23469502,,1545203443,https://ria.ru/20181219/1548230314.html,Илон Маск открыл скоростной подземный туннель под Лос-Анджелесом,203,6,67297
296,23469257,"Нацбанк отчеканит памятные монеты, а ""Укрпочта"" издаст почтовые конверты и марки. Бандера возглавлял ""Организацию украинских националистов""*, действовавшую в середине XX века, ее боевым крылом была ""Украинская повстанческая армия""*, которую сформировали в октябре 1942 года. Она действовала преимущественно на Западной Украине и воевала против советских войск, сотрудничая с гитлеровцами.",1545202044,https://ria.ru/20181219/1548230864.html,На Украине день рождения Бандеры объявили праздником,210,11,69531
297,23469077,"#РИА_Видео 
Новый год все ближе, а вы все еще не знаете, чем порадовать близких? Екатерина Шрейнер покажет, как быстро и просто сделать милую праздничную открытку 🎅🏻",1545200700,,,25,30,67504
298,23468974,"#РИА_ДеньРождения 
В этот день поздравления с юбилеем принимает Галина Волчек. В 1972 году она стала главным режиссером московского театра ""Современник"", а в 1989 году – его художественным руководителем. Ее первая режиссерская работа – спектакль ""Двое на качелях"" по пьесе Уильяма Гибсона, имела большой успех у зрителей. Постановка была в репертуаре театра более 30 лет. Всего Галина Борисовна поставила в ""Современнике"" более 30 спектаклей. Волчек известна и как актриса, в ее фильмографии роли в картинах ""Берегись автомобиля"", ""Король Лир"", ""Осенний марафон"".",1545199944,,,31,17,71502
299,23468883,,1545199520,,,61,55,72296
300,23468720,,1545198525,https://ria.ru/20181219/1548226297.html,В Китае мужчина заработал инфекцию легких из-за грязных носков,59,12,62588
301,23468527,"#РИА_ДеньвИстории 
В этот день военная контрразведка России отмечает 100-летие. С момента создания в 1918 году силовая структура несколько раз меняла свое название, при этом решаемые задачи остаются неизменными. Военная контрразведка пресекает шпионскую деятельность других государств и антиправительственных организаций. Широкую известность в годы Великой Отечественной войны получила спецслужба ""СМЕРШ"" – смерть шпионам. Ее сотрудниками было обезврежено более 40 тысяч диверсантов. В наши дни военная контрразведка предотвращает террористические акты и деятельность зарубежных спецслужб, обеспечивает защиту гостайны.",1545196851,,,34,33,69157
302,23468375,,1545195665,https://ria.ru/20181219/1548227934.html,В китайском городе Ланфан запретили Рождество,69,6,64172
303,23468286,,1545195029,https://ria.ru/20181219/1548228497.html,Приморские ученые создали высокопрочный материал для авиапромышленности,42,9,64146
304,23468129,,1545193988,https://ria.ru/20181219/1548228141.html,Новый губернатор Хабаровского края сократил доплаты к пенсиям чиновников,109,8,71689
305,23467922,В Кузбассе глава города отчитал подчиненного за покрашенную белой водоэмульсионной краской снежную горку: https://ria.ru/20181219/1548228465.html,1545192597,,,140,22,82072
306,23467742,,1545191158,https://ria.ru/20181219/1548226914.html,"Исследование показало, сколько россиян ждут сокращения в начале 2019 года",168,9,68698
307,23467593,,1545189770,https://ria.ru/20181219/1548227622.html,Число тоскующих по СССР россиян достигло максимума за десятилетие,889,48,84976
308,23467485,,1545188142,https://ria.ru/20181219/1548227851.html,У берегов Чукотки заметили редчайшего японского кита,41,8,66642
309,23467406,"Московский медик рассказала, как пережить морозы: https://ria.ru/20181219/1548226389.html",1545186721,,,53,18,72992
310,23467324,,1545185244,https://ria.ru/20181219/1548227221.html,США одобрили продажу Турции систем ПВО Patriot,77,2,67671
311,23467242,"В начале ноября приморский департамент охотнадзора изъял у местных жителей маленького гималайского медвежонка, которого те держали в тесной клетке во дворе дома, и поместил его в центр реабилитации тигров и других редких животных.",1545183712,https://ria.ru/20181219/1548226609.html,В Приморье спасенный из тесной клетки медвежонок залег в спячку,20,4,68827
312,23467163,,1545182229,https://ria.ru/20181218/1548221000.html,Главную новогоднюю елку России доставили в Кремль,93,8,66248
313,23467098,,1545180754,https://ria.ru/20181219/1548224492.html,"Разработчик рассказал о превращении АПЛ ""Ясень"" в ударную субмарину",74,7,63289
314,23467018,"Путешествие в Рождество: новогодняя иллюминация в Москве 
https://ria.ru/20181218/1548174135.html",1545179284,,,124,37,72191
315,23466944,"19 ноября к зданию правительства региона пришел вооруженный пенсионер. В соцсетях появилось видео, на котором чиновница сравнивает его с животным. Женщину привлекли к дисциплинарной ответственности.",1545177573,https://ria.ru/20181219/1548225837.html,"На Камчатке наказали чиновницу, сравнившую пенсионера с животным",77,9,60501
316,23466858,,1545176258,https://ria.ru/20181218/1548220795.html,Премьер-министр Бельгии объявил об отставке,28,3,59761
317,23466720,,1545174772,https://ria.ru/20181219/1548223691.html,Умер заслуженный артист России Олег Мартьянов,41,7,59634
318,23466596,,1545173188,https://ria.ru/20181219/1548224729.html,"МВФ одобрил кредит Украине на 3,9 миллиарда долларов",136,4,61293
319,23466463,,1545171556,https://rsport.ria.ru/20181218/1548202031.html,Загитова - лучшая спортсменка ноября по версии спортивной академии США,66,11,64139
320,23466332,"В Индии сняли на видео слониху, играющую на губной гармошке: https://ria.ru/20181219/1548213879.html",1545170049,,,21,14,70473
