,id,text,date,attachments.link.url,attachments.link.title,comments.count,reposts.count,views.count
662,23415489,"#РИА_ДеньРождения 
515 лет назад родился французский астролог и фармацевт Мишель де Нострдам, известный как Нострадамус. Он начал публиковать свои предсказания в 1555 году в виде сборников стихов. Каждое издание охватывает одно столетие – центурию, и включает в себя 100 четверостиший. До нашего времени сохранилась лишь часть сборников. В своих предсказаниях Нострадамус редко указывал на конкретные даты, чаще временные отрезки и сопутствующие им события обозначаются иносказательно. Исследователи регулярно выдвигают возможные варианты трактовок пророчеств Нострадамуса.",1544772459,,,55,26,69534
663,23415229,,1544770761,https://ria.ru/20181214/1547968363.html,Россия поставила США три ракетных двигателя РД-181,193,10,63311
664,23415110,В Тихом океане дайверы сняли прыжок китенка: https://ria.ru/20181214/1547948715.html,1544769756,,,67,31,93832
665,23414999,,1544768977,https://ria.ru/20181214/1547967676.html,В Уфе самолет ударился хвостом о взлетную полосу,47,1,64009
666,23414811,,1544767892,https://ria.ru/20181214/1547967393.html,Начальника Свердловской железной дороги задержали за взятку,224,19,73982
667,23414723,,1544767307,,,58,73,70554
668,23414614,"""Я использовал его по неосведомленности, считая его разновидностью пиратского флага"", - заявил десантник.",1544766673,https://ria.ru/20181214/1547966033.html,Снявшийся с Порошенко десантник объяснил появление шеврона СС на форме,147,4,70183
669,23414319,"#РИА_ДеньвИстории 
71 год назад СССР отказался от карточной системы. Талоны были введены во время Великой Отечественной войны и существовали в течение 6 лет. Согласно принятому постановлению, все наличные деньги должны были обмениваться на новые купюры образца 1947 года в соотношении 1 к 10. Реформа была необходима для укрепления рубля и изъятия из обращения большого количества фальшивых денег. В других странах-участниках войны отмена талонов произошла позже, чем в СССР.",1544764697,,,108,51,82927
670,23414165,,1544763481,https://ria.ru/20181214/1547962993.html,"В России официально появились ""велосипедные зоны""",108,21,69405
671,23414018,,1544762460,https://ria.ru/20181214/1547966445.html,"Житель ЕАО отобрал у китайца шишки на 3,4 миллиона рублей",131,7,72520
672,23413754,,1544760056,https://ria.ru/20181214/1547965490.html,"Советник Рейгана и Никсона заявил, что Россия ""восстала из пепла""",137,17,72664
673,23413470,,1544757783,https://ria.ru/20181214/1547965313.html,На американской станции в Антарктике нашли мертвыми двух человек,103,11,80915
674,23413298,"Ученые разработали систему контроля бодрствования – так называемую нейрокепку, которая контролирует активность головного мозга, проверяя такие показатели, как рассеянность, утомление, потерю концентрации, а также следит за мышечной активностью человека. Если водитель устал и засыпает, устройство даст звуковой сигнал, а браслет, входящий в комплект, начнет вибрировать.",1544755502,https://ria.ru/20181214/1547964891.html,Водителей школьных автобусов хотят обязать носить нейрокепки,117,17,80589
675,23413159,"Сибирский кот по кличе ""Мир"" набрал вес восемь килограммов и научился понимать японский язык.",1544753432,https://ria.ru/20181214/1547964931.html,Губернатор японской префектуры рассказал о подаренном Путиным коте,84,20,78109
676,23412965,,1544751019,https://ria.ru/20181214/1547964785.html,"В ГД предложили включить в состав поездов вагон ""для одиноких"" людей",192,7,73676
677,23412820,,1544749203,https://ria.ru/20181214/1547964711.html,"""Интеллекта нет"": Соловьев раскритиковал творчество Бузовой",485,22,77670
678,23412714,,1544747396,https://ria.ru/20181214/1547963726.html,"Депутат Рады объяснил, почему Евросоюз обманул Украину",119,6,68879
679,23412617,,1544745188,https://ria.ru/20181213/1547961652.html,В Латакии российские музыканты дали мастер-класс сирийским детям,63,4,66330
680,23412509,,1544742906,https://ria.ru/20181214/1547962626.html,"Роскачество рассказало, как выбрать хорошее шампанское к Новому году",115,7,66478
681,23412347,,1544740579,https://rsport.ria.ru/20181214/1547962934.html,"""Зенит"" проиграл ""Славии"", но вышел в плей-офф Лиги Европы",17,8,65793
682,23412095,В Австралии собаки помогают авиапассажирам справиться с аэрофобией: https://ria.ru/20181213/1547952505.html,1544738774,,,53,11,78027
683,23411810,,1544736739,https://ria.ru/20181214/1547962447.html,"Глава МВД Франции подтвердил ликвидацию ""страсбургского стрелка""",34,5,64750
684,23411560,,1544735059,https://ria.ru/20181213/1547961382.html,"В ЕС считают неуместными санкции из-за ЧП в Черном море, заявил источник",103,6,66997
685,23411255,,1544733493,https://ria.ru/20181213/1547961504.html,Полицейские ликвидировали подозреваемого в стрельбе в Страсбурге,57,6,64222
686,23410928,"Российские космонавты осмотрели внешнюю поверхность корабля ""Союз МС-09"", где ранее было обнаружено отверстие. Кадры из открытого космоса — в подборке Ria.ru https://ria.ru/20181213/1547929602.html",1544732002,,,99,26,72900
687,23410645,"Питание россиян нельзя назвать сбалансированным - люди едят много кондитерских изделий и мало овощей, что влечет за собой рост распространенности ожирения, заявила Вероника Скворцова.",1544730940,https://ria.ru/20181213/1547949428.html?fbclid=IwAR18aR367SO5aKbF2_-UxLHgLJp-0uz95hX2RGem-apPpMEZflJNE28gL4I,"Глава Минздрава считает, что россияне питаются нерационально",550,18,70712
688,23410420,,1544729772,https://ria.ru/20181213/1547943968.html,МИД России предупредил о возможном наступлении ВСУ в Донбассе,204,19,71848
689,23410160,,1544728624,https://ria.ru/20181213/1547960117.html,Политическая инквизиция: как в России отреагировали на признание Бутиной,154,7,69998
690,23409934,"Малозаметные, быстрые, прекрасно вооруженные и практически бесшумные — Тихоокеанский флот России пополнится бригадой подводных лодок проекта 667 ""Лада"". Это проект со сложной судьбой. Головной корабль ""Санкт-Петербург"" спустили на воду еще в 2004-м, но до сих пор он находится в опытной эксплуатации. Об особенностях проекта — в материале Ria.ru",1544727483,https://ria.ru/20181213/1547882479.html,"Как лодки проекта ""Лада"" усилят Тихоокеанский флот",150,7,69221
691,23409658,Встреча завершилась победой россиян со счетом 3:2. Победу сборной России в серии буллитов принес Григоренко.,1544726044,https://rsport.ria.ru/20181213/1547959161.html,Сборная России по хоккею обыграла Швецию в матче Кубка Первого канала,52,32,81945
692,23409409,,1544725069,https://ria.ru/20181213/1547958168.html,ЕС продлил санкции против России,187,8,72511
693,23409372,,1544724868,,,467,129,83165
694,23409168,,1544723672,https://ria.ru/20181213/1547945248.html,"Порошенко назвал три вещи, которых ""боится"" Россия",116,4,63298
695,23408877,,1544722137,https://ria.ru/20181213/1547944415.html,"Совфед разрабатывает закон, который обяжет кормить школьников горячей пищей",198,14,71048
696,23408626,#РИА_ФотоДня,1544720734,,,125,20,79554
697,23408513,"Бывший детдомовец Алексей Маргейм собирает деньги на квартиру и работает в доме ребенка в Челябинске, чтобы забрать оттуда дочь. Ребенка мужчине не отдают из-за отсутствия жилья.",1544720126,https://ria.ru/20181213/1547938000.html,"Житель Челябинска собирает деньги на жилье, чтобы забрать из детдома дочь",152,18,75731
698,23408311,,1544718917,,,136,75,73012
699,23408189,,1544718307,https://ria.ru/20181213/1547954111.html,Бутина признала вину в сговоре с целью нанести вред США,205,6,68925
700,23408164,,1544718136,https://ria.ru/20181213/1547936088.html,"""Атакующий хищник"": эксперт оценил преимущества Су-57 в бою с F-35",126,10,68278
701,23407864,"МВД предложило предоставлять услуги по регистрации автомобилей и мотоциклов в МФЦ по принципу ""одного окна"".",1544716013,https://ria.ru/20181213/1547947712.html,МВД предложило упростить регистрацию машин,53,5,68328
702,23407748,"#ПРЯМАЯТРАНСЛЯЦИЯ 
Выступление Владимира Путина на торжественной церемонии открытия Года театра в России",1544715541,,,118,25,71195
703,23407681,"#РИА_Видео 
Жители Махачкалы Тагир Магомедов и Айдемир Кулдуев настоящие герои. Мужчины спасли девочку, выпавшую из окна пятого этажа. Благодаря им пятилетняя Айша отделалась легкими ушибами.",1544715212,,,152,96,98448
704,23407439,,1544713818,https://ria.ru/20181213/1547947223.html,Археологи нашли в Египте гигантское кладбище времен Тутанхамона,42,14,73888
705,23407344,,1544713458,https://ria.ru/20181213/1547934742.html,"Путин рассказал, кто может быть президентом",234,10,66574
706,23407040,,1544711971,https://ria.ru/20181213/1547932500.html,Кадыров заявил о необходимости большего финансирования Чечни,395,11,70546
707,23406938,"Саванна, каракет, сервал: в Москве прошла выставка самых редких домашних кошек 🐈 
https://ria.ru/20181213/1547912178.html",1544711307,,,23,25,71025
708,23406748,,1544710399,https://ria.ru/20181213/1547944121.html,Центром Дальневосточного федерального округа стал Владивосток,80,14,63593
709,23406642,"Молодая мама Юлия из Нижнего Новгорода привезла грудного сына на обследование в клинику, припарковала свою маленькую KIA у бордюра. А когда вышла из медучреждения, увидела, как совершенно незнакомая женщина колотит по ее машине щеткой для уборки снега. Якобы за то, что авто перегородило выезд. Досталось и самой Юлии: разъяренная незнакомка пробила ей череп той же щеткой.",1544709763,https://ria.ru/20181213/1547881997.html,В Нижнем Новгороде женщине с ребенком проломили череп из-за парковки,163,14,67974
710,23406548,,1544709117,https://ria.ru/20181213/1547935198.html,"Путин рассказал, как математика повысила его самооценку",102,10,64437
711,23406444,,1544708175,https://ria.ru/20181213/1547936732.html,"Киселев заявил, что готов взять украинскую журналистку Бойко на работу",135,3,70001
712,23406407,,1544707720,https://rsport.ria.ru/20181213/1547940362.html,Сборная России по биатлону выиграла смешанную эстафету на этапе Кубка IBU,29,18,65853
713,23406273,,1544706806,https://rsport.ria.ru/20181213/1547934929.html,Мамаев прислал жене из СИЗО цветы и открытку со смешной подписью,82,1,66343
714,23406221,,1544706366,,,107,26,68162
715,23406166,"Сегодня Александра известна как автор более 20 скульптурных проектов по всему миру, она работает с металлом во всех формах. Девушка рассказала о том, каково носить на себе 20 килограммов железа и как на ее профессию реагируют мужчины.",1544705866,https://ria.ru/20181213/1547886331.html,Зачем девушке идти в сварщицы,41,3,56261
716,23405989,,1544704686,https://ria.ru/20181213/1547934258.html,"Более 50 архиереев УПЦ вернули приглашения на ""объединительный собор""",32,10,63195
717,23405821,"Он предложил незнакомцу еду, а потом кинул ее в лицо мужчине. Инцидент сняли на видео друзья ""шутника"" и разместили запись в соцсетях. 
Свое поведение мужчина объяснил тем, что был пьян и не поверил, что перед ним настоящий бездомный, поэтому решил предложить десять фунтов стерлингов.",1544703405,https://ria.ru/20181213/1547929825.html,Британец начал получать угрозы после издевательств над бездомным,48,3,62450
718,23405691,,1544702359,https://ria.ru/20181213/1547931677.html,В Госдуме предложили запретить работать в такси без российского гражданства,219,16,67714
719,23405600,,1544701572,http://ria.ru/20181213/1547925184.html,Израильская армия блокировала столицу Палестины,63,4,63475
720,23405460,,1544700344,https://rsport.ria.ru/20181213/1547928746.html,Пригода завоевал золото ЧМ на двухсотметровке брассом с мировым рекордом,30,16,66295
721,23405391,"#ПРЯМАЯТРАНСЛЯЦИЯ 
Путин принимает участие во Всероссийском открытом уроке ""Направление прорыва""",1544699890,,,124,4,72082
722,23405325,,1544699095,https://ria.ru/20181213/1547916333.html,"В Индии леопард растерзал монаха, медитировавшего под деревом",84,7,60068
723,23405272,"Рыбалка на льду или просто зимние прогулки по реке могут обернуться несчастным случаем. Будьте осторожны: лед далеко не везде так надежен, как кажется на первый взгляд: https://ria.ru/20181213/1547912361.html",1544698390,,,23,10,65660
724,23405183,,1544697479,https://rsport.ria.ru/20181213/1547919479.html,В Австрии рассказали о расследовании дела российских биатлонистов,28,6,61359
725,23405040,,1544696363,,,55,111,77422
726,23405033,,1544696330,https://ria.ru/20181213/1547906983.html,"В Красноярске мать убила дочь за то, что у той было несколько ухажеров",156,8,62844
727,23404925,,1544695435,https://ria.ru/20181213/1547918679.html,ФАС возбудила дело из-за повышения цен на ТВ-приставки,81,8,59818
728,23404852,"Мы рассказывали вам о шестилетнем Алеше Нечаеве из Москвы. У него тяжелый порок сердца – коарктация аорты. Сужена главная артерия, снабжающая кровью все органы, повышено давление в сосудах мозга, организм страдает от дефицита кислорода. Алешу мучают постоянные головные боли и слабость, от любой нагрузки возникает одышка. Врачи говорят о высоком риске инсульта. Мальчика спасет операция, в ходе которой расширят стенки аорты с помощью стента. Операция нужна как можно скорее, но госквоты на кардиохирургические вмешательства уже закончились, а оплатить дорогое лечение родители Алеши не в силах: https://sn.ria.ru/20181212/1547820332.html 
МИА ""Россия Сегодня"" и Русфонд объявляли сбор средств для спасения Алеши Нечаева: https://rusfond.ru/ria_actions/053. Мы рады сообщить, что необходимая сумма собрана! Спасибо всем, кто откликнулся и помог спасти жизнь!",1544694671,,,48,6,66955
729,23404782,,1544693990,https://ria.ru/20181213/1547919179.html,Житель Перми выставил на продажу усы своих котов,61,8,60766
730,23404645,"#РИА_Видео 
В Анкаре сошли с рельсов два вагона скоростного поезда. В результате аварии погибли девять человек, 46 пострадали. На месте происшествия работают врачи и спасатели: https://ria.ru/20181213/1547904021.html",1544692678,,,28,15,65706
731,23404489,,1544691205,https://rsport.ria.ru/20181213/1547904683.html,Юниорская сборная России по хоккею разгромила словаков в матче Турнира четырех наций,21,11,62976
732,23404366,"#РИАрхив 
В этот день в 1930 году родился советский актер Николай Рыбников. Он полюбился зрителям по картинам ""Весна на Заречной улице"", ""Высота"", ""Девчата"".",1544690536,,,58,32,73458
733,23404279,,1544689981,https://ria.ru/20181213/1547911838.html,"В Сети недоумевают, почему Time не выбрал Вышинского ""Человеком года""",65,6,61287
734,23404106,,1544688894,https://ria.ru/20181213/1547912901.html,Россия объявила персоной нон грата словацкого дипломата,109,11,62449
735,23404059,,1544688505,https://ria.ru/20181213/1547912443.html,МВД ввело мораторий на изменения правил дорожного движения,33,1,60430
736,23403892,Опубликовано видео полетов Ту-160 над Карибским морем: https://ria.ru/20181213/1547905439.html,1544687408,,,141,4,73000
737,23403829,"#ПРЯМАЯТРАНСЛЯЦИЯ 
Еженедельный брифинг Марии Захаровой",1544686826,,,57,9,66502
738,23403756,,1544686326,https://ria.ru/20181213/1547908399.html,"ФСБ задержала семь человек, собиравших деньги для боевиков",45,6,62103
739,23403660,,1544685403,https://ria.ru/20181213/1547906848.html,Боксер Усик заявил о готовности защищать Киево-Печерскую лавру,75,12,64279
740,23403508,,1544684135,https://ria.ru/20181213/1547893788.html,В Тасмании обнаружено самое высокое в мире лиственное дерево,27,10,61214
741,23403355,,1544682656,,,66,30,67734
742,23403279,"#РИА_Видео 
Екатерина Шрейнер создает игрушки к Новому году своими руками. В видео она показывает, как быстро и просто сделать праздничное украшение для елки. А вы уже начали подготовку к Новому году? 🌲",1544681953,,,33,59,71707
743,23403192,"#РИА_ДеньРождения 
115 лет назад родился сатирик Евгений Петров. Читатели знают его благодаря сотрудничеству с Ильей Ильфом. Они познакомились в 1926 году во время работы в газете ""Гудок"", там же были опубликованы первые совместные работы. Спустя два года вышел в свет знаменитый роман ""Двенадцать стульев"". Следующей общей книгой стал ""Золотой теленок"". В 1935-1936 годах соавторы совершили путешествие по США, результатом которого стал путевой очерк ""Одноэтажная Америка"". Произведения писателей переведены на десятки языков, неоднократно переиздавались и экранизировались. Самостоятельно Петров создал сценарии к фильмам ""Тиха украинская ночь"" и ""Воздушный извозчик"".",1544681143,,,23,22,65645
744,23403043,,1544680182,https://ria.ru/20181213/1547901989.html,Американские СМИ назвали Россию и Китай угрозой для человечества,220,13,65714
745,23402888,"#РИА_ДеньвИстории 
47 лет назад на экраны вышла любимая многими кинокомедия Александра Серого по совместному сценарию Георгия Данелия и Виктории Токаревой ""Джентльмены удачи"". Первым зрителем стал генсек Леонид Ильич Брежнев, после его одобрения картину приняли члены комиссии. В 1972 году художественный фильм стал лидером проката, его посмотрели более 65 миллионов человек. Многие реплики актеров разошлись на цитаты – ""Пасть порву, моргала выколю!"", ""Кто ж его посадит - он же памятник!"".",1544678405,,,50,40,68964
746,23402765,,1544676955,https://ria.ru/20181213/1547904021.html,В Анкаре сошел с рельсов скоростной поезд,28,6,63368
