,id,text,date,attachments.link.url,attachments.link.title,comments.count,reposts.count,views.count
490,23443365,"#РИА_Видео 
В прошлом столетии в Пермь перевезли почти весь речной флот России. Корабли были затоплены. Однако теперь на дне Камского водохранилища находится самое большое кладбище кораблей в мире",1544980630,,,126,71,92941
491,23443179,,1544979463,https://ria.ru/20181216/1548068654.html,"Пародия на автокефалию: как в мире отреагировали на ""объединительный собор""",94,12,71075
492,23443000,#РИА_ФотоДня,1544978505,,,52,5,82946
493,23442825,,1544977409,https://ria.ru/20181216/1548068121.html,Разбившийся 30-летний Су-27 был одним из новейших на Украине,98,4,78835
494,23442672,,1544976471,,,97,33,77653
495,23442582,"Назван продукт, помогающий сбросить лишний вес: https://ria.ru/20181216/1548066316.html",1544975891,,,37,9,75178
496,23442374,"Более 53% японцев считают, что правительство во главе с премьер-министром Синдзо Абэ должно сфокусироваться на переговорах с Россией.",1544974576,https://ria.ru/20181216/1548059522.html,"В Японии провели опрос, посвященный спорным островам",194,5,79242
497,23442194,,1544973354,https://ria.ru/20181216/1548066608.html,В Канаде хозяйка случайно отправила кота по почте,39,12,73866
498,23442064,"#РИА_Видео 
Недавно под Каиром археологи обнаружили нетронутую гробницу возрастом 4400 лет. Выяснили, что ее владелец был священником и надзирателем королевского дворца. А еще там обнаружены 45 резных статуй.",1544972420,,,63,22,76532
499,23441877,,1544971224,https://rsport.ria.ru/20181216/1548059565.html,"Аршавин получил должность в академии ""Зенита""",48,7,74394
500,23441807,,1544970786,,,80,16,73327
501,23441686,"Она обратила внимание на цинизм журналистов телеканала Би-би-си, который ""всю жизнь пропагандировал именно непредвзятый и независимый подход, профессионализм в качестве кредо своего издания"".",1544970005,https://ria.ru/20181216/1548064644.html,"Захарова призвала британскую общественность дать оценку ""фейкам"" Би-би-си",63,6,73055
502,23441549,,1544968824,https://ria.ru/20181216/1548063488.html,Названа стоимость американского истребителя шестого поколения,128,3,69478
503,23441398,"В распоряжение редакции попала переписка корреспондента Русской службы Би-би-си с одним из стрингеров во Франции, который живо интересуется у собеседника, нельзя ли выжать из имеющихся фактов вывод о том, что за происходящим стоит Россия. ""Да, я ищу углы, — говорит в переписке корреспондент Би-би-си. — Редакция требует крови, че"". 
Кому выгодно найти ""русский след"" в протестах во Франции и для чего - в материале Ria.ru.",1544967702,https://ria.ru/20181216/1548055497.html,Колонка Виктора Мараховского,70,9,69515
504,23441257,,1544966733,https://ria.ru/20181216/1548063276.html,В Эстонской церкви главой УПЦ по-прежнему считают митрополита Онуфрия,160,8,72557
505,23441052,,1544965342,https://ria.ru/20181216/1548063141.html,В Приморье пытались голосовать по поддельным паспортам СССР,111,12,71006
506,23440832,,1544964084,https://rsport.ria.ru/20181216/1548062188.html,Российские пловцы установили новый рекорд по победам на чемпионатах мира,42,21,78351
507,23440624,"У петербурженки Галины Ивановны Яковлевой, пережившей блокаду, более полутысячи подопечных — пожилых людей и инвалидов. Несмотря на проблемы со здоровьем, пенсионерка ежедневно отправляется в офисы предпринимателей и фондов, заполняет свой фургончик продуктами, одеждой и развозит нуждающимся. Кроме того, она организует для стариков культурный досуг: добывает бесплатные билеты в театры и музеи.",1544962871,https://ria.ru/20181216/1548009502.html,Бабушка-блокадница из Петербурга купила фургон и развозит еду нуждающимся,83,34,80613
508,23440429,,1544961751,,,137,53,80153
509,23440295,"#РИА_Видео 
Китайский фермер-модник Доу Сяоган создает необычные наряды из предметов домашнего обихода и того, что многие бы отправили в мусор. Этим он хочет показать, что дизайнерское искусство может быть не только красивым, но и экологичным.",1544961087,,,56,5,71685
510,23440062,"И это не то, о чем вы подумали!",1544959870,https://ria.ru/20181216/1548058887.html,Названа древнейшая профессия на Земле,68,5,74700
511,23439869,"18-летняя Юлия Полячихина из Чувашии представляет Россию на конкурсе красоты ""Мисс Вселенная-2018"", который проходит в эти дни в Бангкоке. Девушка уже приняла участие в показе национальных костюмов, купальников и вечерних платьев. Впереди – финал конкурса. Имя победительницы объявят 17 декабря. Болеем за нашу красавицу! 🇷🇺",1544958960,,,218,24,86143
512,23439751,,1544958234,https://ria.ru/20181216/1548059130.html,"УПЦ отказалась признать созданную на ""объединительном соборе"" Церковь",160,7,71380
513,23439446,"В качестве главной новогодней елки России в этом году выбрали столетнее дерево из Щелковского района Московской области. Высота елки составляет 27 метров, диаметр — 60 сантиметров 🎄🎅🏻",1544956688,https://ria.ru/20181216/1548059697.html,В Подмосковье срубили главную новогоднюю ель страны,188,17,78643
514,23439263,,1544955577,https://ria.ru/20181216/1548059451.html,Кожемяко лидирует на повторных выборах главы Приморья,118,2,71363
515,23439089,"#РИА_Видео 
Владимир Путин встретился с Артёмом Пальяновым из Ленинградской области – мальчиком, который мечтал увидеть Санкт-Петербург с высоты птичьего полёта, и желание которого глава государства ранее обещал исполнить. Президент поздравил Артема и его семью с наступающими праздниками, вручил подарки и лично проводил их до вертолетной площадки. После полета Путин поинтересовался у ребёнка, как он покатался. ""Обалденно"", - ответил тот.",1544954511,,,458,27,100005
516,23438854,"Ранее СМИ сообщили, что пилота Georgian Airways временно отстранили от работы за любовь к российской столице. Во время посадки пилот обратился к диспетчеру одного из аэропортов города со словами ""любимая великая Москва"".",1544953056,https://ria.ru/20181216/1548057068.html,"""Победа"" готова взять грузинского пилота, признавшегося в любви к Москве",158,25,83431
517,23438688,,1544951874,https://ria.ru/20181216/1548057595.html,"Би-би-си требует доказать ""вмешательство России"" в протесты во Франции",162,10,74947
518,23438545,"#РИАрхив 
Сегодня день рождения празднует актриса и режиссер Светлана Дружинина.",1544950946,,,34,18,79319
519,23438416,"СМИ сообщили, что пассажирский автобус, следовавший из Генуи в Дюссельдорф, попал в ДТП недалеко от швейцарского Цюриха. В результате аварии один человек погиб, 44 пострадали.",1544950033,https://ria.ru/20181216/1548057041.html,В ДТП с автобусом в Швейцарии пострадали десять россиян,60,4,70662
520,23438192,"Ягуары смогли выбраться из вольера в то время, когда в зоопарке были посетители. Усыпить животных возможности не было и их застрелили.",1544948579,https://ria.ru/20181216/1548056405.html,Два ягуара сбежали из Афинского зоопарка ,120,5,76641
521,23438065,,1544947839,,,124,92,86397
522,23437916,"""Бегущая мишень"": в Сети высмеяли новый автомобиль Нацгвардии Украины: https://ria.ru/20181216/1548056097.html",1544946884,,,287,11,83759
523,23437730,"В Киеве завершился ""объединительный собор"", на котором был избран глава создаваемой властями ""незалежной церкви"". Им стал представитель раскольнического ""Киевского патриархата"" Епифаний Думенко. О том, какими проблемами для светского Киева чревато его избрание и что будет дальше с украинским православием, — в материале Ria.ru.",1544945361,https://ria.ru/20181215/1548049422.html,"Чем обернется ""объединительный собор"" для Украины",200,3,75584
524,23437612,,1544944203,https://ria.ru/20181216/1548054687.html,В ЦИК рассказали о ходе губернаторских выборов в Приморье,49,3,71550
525,23437524,,1544943429,https://ria.ru/20181216/1548052836.html,"""Роскосмос"" расскажет о появлении дыры в ""Союзе"" иностранным партнерам",78,5,67024
526,23437426,Сборная России со счетом 7:2 разгромила чехов в своем втором матче на домашнем этапе Евротура - Кубке Первого канала. Самые запоминающиеся моменты встречи смотрите в нашей фотоленте: https://rsport.ria.ru/20181215/1548042637.html,1544942250,,,44,36,84691
527,23437274,"#РИА_ДеньРождения 
В этот день юбилей отмечает Юрий Николаев. Для нескольких поколений его имя неизменно связано с одной из самых популярных передач советского телевидения – музыкальной программой ""Утренняя почта"". Николаев был ее бессменным ведущим с 1975 по 1991 год. Некоторые зрители помнят его по другим телевизионным проектам – ""Спокойной ночи, малыши!"" или ""Танцы со звездами"". Сейчас Юрий Николаев продолжает работать на телевидении и ведет новое утреннее шоу. Поздравляем с днем рождения!",1544940799,,,72,23,84951
528,23437154,,1544939571,https://rsport.ria.ru/20181216/1548054280.html,Юниорская сборная России стала победителем Турнира четырех наций в США,28,15,75548
529,23436976,"#РИА_ДеньвИстории 
21 год назад в эфир вышла скандально известная 38 серия первого сезона аниме ""Покемон"". По сюжету главные герои оказываются внутри компьютера, где им предстоит уничтожить опасный вирус. На 20-й минуте происходит взрыв, сопровождающийся частой сменой красного и синего цветов. Серия вызвала у юных зрителей эпилептические припадки. 685 японских детей в возрасте от трех лет пришлось госпитализировать. По этой причине данная серия не вышла в эфир в других странах мира.",1544937571,,,73,28,83116
530,23436907,,1544936397,https://ria.ru/20181216/1548053545.html,В Вологде после взрыва газа в жилом доме ввели режим ЧС,49,7,65668
531,23436838,,1544935345,https://ria.ru/20181216/1548052708.html,Семья погибшей в США девочки из Гватемалы требует прозрачного расследования,30,1,68322
532,23436723,,1544933229,https://ria.ru/20181216/1548052573.html,Японская газета рассказала о возрождении рыбной отрасли России,184,14,73410
533,23436598,,1544931033,https://ria.ru/20181216/1548051830.html,Конструктор украинских бронекатеров пожаловался на отсутствие ракет,70,7,68141
534,23436504,,1544928622,https://ria.ru/20181216/1548052238.html,National Interest сравнил российский Ил-112В с украинским Ан-140,79,4,66096
535,23436411,,1544926744,https://ria.ru/20181216/1548052011.html,В Нью-Джерси запретят цирковые представления с дикими животными,66,12,73158
536,23436321,,1544924818,https://ria.ru/20181216/1548052352.html,Apple обвинили в завышении характеристик iPhone X,68,2,65293
537,23436242,,1544922608,https://ria.ru/20181216/1548051071.html,Эксперт: власти США ответственны за трагедию с гватемальской девочкой,89,3,66626
538,23436132,,1544919597,https://rsport.ria.ru/20181215/1548045487.html,Российский саночник Репилов завоевал золото на этапе Кубка мира в США,44,12,70806
539,23436018,,1544917647,https://ria.ru/20181216/1548051731.html,"США призвали Германию отказаться от ""Северного потока — 2""",128,5,68200
540,23435860,,1544914855,https://ria.ru/20181216/1547997419.html,В Эквадоре воскресла рогатая сумчатая лягушка,55,16,69263
541,23435629,,1544912330,https://ria.ru/20181216/1548050764.html,В жилом доме в Вологде взорвался газ,86,12,72967
542,23435536,,1544911537,https://ria.ru/20181216/1548050672.html,"Представитель патриарха Кирилла назвал ""собор"" в Киеве сборищем разбойников",208,6,75387
543,23435336,,1544909415,https://ria.ru/20181215/1548012569.html,Назван лучший архитектурный проект мира,51,7,72287
544,23435105,,1544907311,https://ria.ru/20181215/1548049787.html,"В Сети высмеяли фотографию Порошенко с ""объединительного собора""",122,7,70210
545,23435004,,1544906563,https://ria.ru/20181215/1548049868.html,"Умер артист из ""Кривого зеркала"" Обид Асомов",80,20,72316
546,23434860,,1544905447,https://ria.ru/20181215/1548030928.html,"В Крыму заявили, что ЕС живет в параллельной реальности",109,7,72866
547,23434607,,1544903493,https://rsport.ria.ru/20181215/1548047093.html,МОК потребовал от Зубкова и еще 10 россиян вернуть медали ОИ в Сочи,139,7,71054
548,23434428,"В Японии стремительно падает рождаемость, а молодые люди не спешат создавать семьи. И если женский страх разрушить карьеру типичен не только для Страны восходящего солнца, то с мужчинами ситуация иная. Они, как отмечают сами японцы, стали ""травоядными"" и избегают интимных отношений. На что уходят их силы — в материале Ria.ru.",1544902280,https://ria.ru/20181215/1548002989.html,Почему японские мужчины перестали заниматься сексом,147,15,75141
549,23434212,,1544901079,https://ria.ru/20181215/1548029520.html,Нобелевский лауреат Надя Мурад потратит премию на строительство больницы,31,8,75380
550,23434003,,1544899880,https://ria.ru/20181215/1548047241.html,"БПЦ назвала ""новую церковь"" на Украине раскольнической",249,10,73310
551,23433786,,1544898829,https://rsport.ria.ru/20181215/1548030184.html,Овечкин признан первой звездой дня в НХЛ,49,8,75421
552,23433516,,1544897536,https://ria.ru/20181215/1548041472.html,Названы самые надежные автомобили в мире,87,3,73493
553,23433176,"#РИА_Видео 
Число задержанных на протестах ""желтых жилетов"" в Париже превысило 150 человек, более 100 человек помещены под стражу: https://ria.ru/20181215/1548045874.html",1544896283,,,235,10,82225
554,23432890,,1544895033,https://ria.ru/20181215/1548044954.html,"РПЦ назвала избрание ""главы новой церкви"" на Украине канонически ничтожным",171,5,74570
555,23432745,,1544894470,,,124,77,77406
556,23432582,"#РИА_Видео 
Новогоднее дерево для центральной площади в Челябинской области срубили прямо на улице. Этой елке - полвека. Горожане возмущены таким варварством.",1544893819,,,196,32,83349
557,23432287,"Американским авианосным группам не хватает ""радиуса действия, выносливости, жизнеспособности и специализации"" для проведения операций, способных нанести поражение великим державам.",1544892603,https://ria.ru/20181215/1548045282.html,Американскому флоту предрекли поражение в войне с Россией,427,13,77260
558,23432259,,1544892413,,,121,82,70275
559,23432098,,1544891351,https://ria.ru/20181215/1548042171.html,На стройке в Зеленограде нашли снаряд времен ВОВ,19,6,65748
560,23431952,"#ПРЯМАЯТРАНСЛЯЦИЯ 
Акции протеста ""желтых жилетов"" во Франции. Протесты движения, выступающего в том числе против повышения цен на бензин, начались во Франции 17 ноября. Массовые акции сопровождаются столкновениями с полицией, погромами и поджогами машин, разрушениями магазинов и банков",1544890681,,,123,4,71589
561,23431871,"#ПРЯМАЯТРАНСЛЯЦИЯ 
Владимир Путин выступает с речью на гала-концерте в Большом зале филармонии Санкт-Петербурга по случаю юбилея маэстро Юрия Темирканова",1544890223,,,39,2,66959
562,23431827,,1544889987,https://ria.ru/20181215/1548040454.html,Усик ответил на угрозы из-за обещания защищать Киево-Печерскую лавру,44,5,66729
563,23431613,,1544888670,https://ria.ru/20181215/1548043360.html,"Порошенко объявил о создании ""украинской автокефальной церкви""",182,7,67383
564,23431408,,1544887813,https://ria.ru/20181215/1548042874.html,"На Украине избрали главу ""новой церкви""",230,9,68660
565,23431277,"Президент России поинтересовался у ребёнка, как он покатался. ""Обалденно"", - ответил тот. Президент поинтересовался у мальчика, распаковали ли они подарки, которые им приготовлены. Ребёнок признался, что пока нет. ""Начинайте, - посоветовал Путин, - это приятное занятие"".",1544887242,https://ria.ru/20181215/1548041912.html,"Мальчик рассказал о полете на вертолете, который ему обещал Путин",190,8,76597
566,23431043,"#РИА_Видео 
В Екатеринбурге есть восходящая звезда - мини-пиг Джузеппа 🐽 Анастасия завела себе любимицу недавно - свинке всего полгода и по размеру она меньше кошки, но за ее жизнью в Instagram следят уже более 60 тысяч человек!",1544885789,,,117,28,71034
567,23430736,,1544884045,https://ria.ru/20181215/1548040118.html,На Украине разбился Су-27,185,7,70005
568,23430557,"Современная система навигации, повышенная живучесть, вдвое увеличенный срок службы и новое высокоточное ракетное вооружение — после масштабной модернизации атомные подводные лодки проекта 949А станут действительно универсальными и смогут решать более широкий круг задач. На днях командующий Тихоокеанским флотом адмирал Сергей Авакянц сообщил, что ""Антеи"" адаптируют под ракетный комплекс ""Калибр"". О целях ""тюнинга"" — в материале Ria.ru.",1544882944,https://ria.ru/20181215/1548001411.html,"Зачем атомоходы  ""Антей"" вооружают новыми ракетами",42,10,68727
569,23430301,,1544881664,https://ria.ru/20181215/1548038487.html,Путин прокомментировал ситуацию с отменой рэп-концертов,141,8,67047
570,23430141,"#ПРЯМАЯТРАНСЛЯЦИЯ 
Акции протеста ""желтых жилетов"" во Франции. Протесты движения, выступающего в том числе против повышения цен на бензин, начались во Франции 17 ноября. Массовые акции сопровождаются столкновениями с полицией, погромами и поджогами машин, разрушениями магазинов и банков.",1544880866,,,265,7,71339
571,23430091,,1544880536,https://ria.ru/20181215/1548035706.html,В Египте нашли нетронутую гробницу возрастом более четырех тысяч лет,48,11,64281
572,23429817,,1544879014,https://ria.ru/20181215/1548037386.html,"Названо ""самое счастливое место"" в мире",54,3,63075
573,23429799,,1544878936,,,42,93,71789
