,id,text,date,attachments.link.url,attachments.link.title,comments.count,reposts.count,views.count
0,23460201,"В канун Нового года все желания сбываются! ✨
Делитесь самыми добрыми новогодними поздравлениями, пожеланиями или присылайте короткие новости – и мы покажем их в бегущей строке на Елке ""Россия Сегодня"" в ГУМе, возле Главной площади страны! Наша Елка сказочная, а потому не только показывает новости со всего мира на бегущей строке online, но и исполняет желания! Проверим? 🎄
Условия просты: 
• подпишитесь на [club15755094|РИА Новости]; 
• сделайте репост этой записи; 
• отправьте поздравление не более 70 символов (с пробелами) в комментарий к этому посту или присылайте на почту elka@rian.ru 
Каждый день с 20:00 до 21:00 ловите свои поздравления и пожелания в ГУМе на нашей Елке в Главной галерее вплоть до 25 декабря!",1545134415,,,248,48,157915
1,23514762,,1545509326,https://ria.ru/20181222/1548497667.html,"Кадыров рассказал, как хочет завершить карьеру",3,2,1948
2,23514714,,1545508947,https://ria.ru/20181222/1548460367.html,Крым ждет рекордное число туристов в новогодние праздники,18,0,6452
3,23514598,,1545507916,https://ria.ru/20181222/1548484485.html,Ученые назвали способ омолодить мозг,16,8,17407
4,23514442,,1545506725,https://ria.ru/20181222/1548488564.html,"В Африке хотят лишить Disney прав на фразу ""акуна матата""",43,3,23495
5,23514321,,1545505506,https://ria.ru/20181222/1548460965.html,Французские ученые нашли способ уничтожать зараженные ВИЧ клетки,29,6,28807
6,23514191,"""Это правда, позвонили ему сегодня в 12 часов дня. Разговор длился 53 минуты. Запись выложим завтра"", - сказал Владимир Кузнецов.",1545504460,https://ria.ru/20181222/1548494889.html,"Пранкер Вован подтвердил, что общался с главой ""новой церкви"" Украины",72,4,33399
7,23514052,,1545503287,https://rsport.ria.ru/20181222/1548493978.html,"Щербакова выиграла чемпионат России,  Загитова стала пятой",72,9,36478
8,23513897,,1545502091,https://ria.ru/20181222/1548487180.html,"В Киеве заявили, что главе ""новой церкви"" позвонили пранкеры",46,3,37924
9,23513693,,1545500795,https://ria.ru/20181222/1548483259.html,"Астронавт NASA показал, как заново учится ходить после полета в космос",54,5,41304
10,23513556,,1545499569,https://ria.ru/20181222/1548490261.html,"Против украинского премьера возбудили уголовное дело, пишут СМИ",60,3,42101
11,23513413,#РИА_ФотоДня,1545498561,,,260,14,53667
12,23513361,,1545498132,,,67,57,45521
13,23513272,В Сети появилось видео пожара на шахте в Соликамске: https://ria.ru/20181222/1548486025.html,1545497432,,,34,4,45265
14,23513116,"Ученые назвали три периода в жизни, когда человек наиболее одинок: https://ria.ru/20181222/1548483303.html",1545496476,,,52,4,48811
15,23512908,,1545495387,https://ria.ru/20181222/1548487342.html,"Лидер группы ""Бумбокс"" сравнил Россию с ""черной дырой""
",242,4,50080
16,23512748,"#РИА_Видео 
Очень общительную и задорную свинку Базуку недавно отдали в Центр реабилитации животных. Семья сначала взяла ее, а потом передумала держать дома экзотического мини-пига. 
Теперь сотрудники центра хотят искать дом для Базуки только после новогодних праздников - чтобы она не стала просто подарком к новому году.",1545494165,,,47,15,47219
17,23512558,,1545493004,https://ria.ru/20181222/1548486679.html,SpaceX в третий раз отложила запуск ракеты с военным спутником GPS,117,3,49359
18,23512448,,1545492269,http://ria.ru/20181222/1548486392.html,В Одессе нашли цистерну с человеческими скелетами,40,12,48713
19,23512215,,1545490832,,,105,9,50570
20,23512149,,1545490389,https://ria.ru/20181222/1548483735.html,Имена погибших в ДРК российских пилотов назовут в понедельник,10,4,45900
21,23511971,,1545489172,https://ria.ru/20181222/1548483811.html,Два Су-30М2 приземлились на новую полосу аэродрома Бельбек в Крыму,111,8,54213
22,23511869,,1545488249,https://ria.ru/20181222/1548473206.html,"Спорт, релакс, экскурсии. Чем заняться в Новый год в Краснодарском крае",36,6,51014
23,23511720,,1545487092,https://ria.ru/20181222/1548477606.html,Порошенко подписал закон о переименовании канонической УПЦ,126,5,48019
24,23511588,,1545485956,https://ria.ru/20181222/1548461679.html,"Житель Башкирии перед Новым годом стал миллионером, выиграв в лотерею",86,5,54666
25,23511435,,1545484821,https://ria.ru/20181222/1548467656.html,Умер российский физик-теоретик Сергей Псахье,85,8,54129
26,23511395,,1545484572,,,56,28,55430
27,23511299,,1545483739,https://ria.ru/20181222/1548462634.html,На Ленинградской АЭС навсегда остановили первый в мире энергоблок,66,15,51865
28,23511190,#ЦеЕвропа,1545482873,https://ria.ru/20181222/1548473479.html,Херсонский суд рассмотрит вопрос о продлении ареста Вышинского,54,2,54063
29,23511058,"#РИА_Видео 
Казаку Захару Максимову всего 14 лет, его рост 115 сантиметров, но это не мешает ему виртуозно владеть шашкой и скакать на коне. Благодаря своей целеустремленности он уже дорос до должности командира казачьего отряда.",1545481815,,,239,14,66802
30,23510929,"Ранее стало известно, что задымление на шахте произошло из-за возгорания метана. ""Уралкалий"" информацию не подтверждает.",1545480559,https://ria.ru/20181222/1548471280.html,"СК начал проверку после задымления на шахте ""Уралкалия"" в Соликамске",23,5,52451
31,23510755,,1545479223,https://ria.ru/20181222/1548468676.html,"Посол США пожаловался на ""антиамериканскую риторику"" журнала Spiegel",58,7,53961
32,23510536,"Восемь горняков уже вывели на поверхность из шахты, в зоне задымления остались девять человек.",1545477759,https://ria.ru/20181222/1548467906.html,На шахте в Соликамске произошел пожар ,25,7,56011
33,23510310,,1545476498,,,32,42,57760
34,23510252,"В России завершили создание крупнейшей в мире системы цифрового телевещания. В поселке Видяево Мурманской области состоялась торжественная церемония запуска последнего, 5040-го по счету объекта цифрового эфирного вещания — башни ""Ура"": https://ria.ru/20181222/1548466600.html",1545476249,,,126,12,60219
35,23509959,"#РИА_Видео 
Собачка Кукла уже пережила все ужасы войны. Ее мордочку срубило осколком мины во время боевых действий в Донбассе. Теперь она восстанавливается в приюте ""Республика друг"" в подмосковной Черноголовке.",1545474627,,,105,49,69621
36,23509767,,1545473709,https://ria.ru/20181222/1548465307.html,"NASA предупредило о приближении к Земле ""праздничного"" астероида",93,11,57417
37,23509538,"Президент Владимир Путин подписал указы о помиловании пятерых россиян. Среди тех, кто уже к Новому году сможет выйти на свободу, — каскадер, пытавшийся защитить брата во время дворовой драки, и герой войны в Афганистане, сбивший на темной трассе подростка-мотоциклиста. Выяснили детали уголовных дел тех, чьи прошения о помиловании услышали в Кремле.",1545472398,https://ria.ru/20181222/1548442918.html,"Истории пятерых россиян, амнистированных Путиным",120,14,72292
38,23509409,"#ПРЯМАЯТРАНСЛЯЦИЯ 
Протесты ""желтых жилетов"" во Франции. Несогласные с политикой властей, возмущенные повышением цен на топливо, а также снижением покупательской способности ""желтые жилеты"" начали выходить на улицы по всей Франции с 17 ноября. Масштабные протесты сопровождаются столкновениями демонстрантов с полиций, погромами, поджогами машин.",1545471668,,,260,16,71622
39,23509279,"#РИА_Видео 
Этой ночью жители северной столицы наблюдали получасовое огненное шоу — в центре города загорелся склад пиротехники. Тушить его было крайне опасно из-за разрывающихся фейервеков, но спасателям удалось справиться с огнем.",1545470713,,,77,32,68275
40,23509137,"#РИАрхив 
81 год назад родился Эдуард Успенский – автор детских повестей ""Крокодил Гена и его друзья"", ""Дядя Федор, пес и кот"", ""Каникулы в Простоквашино"".",1545469771,,,24,23,62219
41,23509117,,1545469664,,,204,93,73425
42,23508950,,1545468699,https://ria.ru/20181222/1548462851.html,Украинские железные дороги пожаловались на нехватку российских запчастей,377,7,55521
43,23508747,"Для многих знаменитых супружеских пар уходящий год оказался очень непростым. Звезды, чьи браки распались в 2018-м, — в фотоленте Ria.ru: https://ria.ru/20181222/1547888672.html",1545467495,,,75,7,58349
44,23508576,В Рязани два футболиста избили и ограбили женщину: https://rsport.ria.ru/20181222/1548462783.html,1545466698,,,234,8,70148
45,23508420,"Сияние Загитовой, осечка Медведевой, победа Ковтуна, лидерство Тарасовой и Морозова и победа Синициной и Кацалапова и другие итоги первых дней чемпионата России по фигурному катанию: https://rsport.ria.ru/20181222/1548449355.html",1545465303,,,59,12,58381
46,23508180,,1545463442,https://ria.ru/20181222/1548461620.html,Названы худшие фильмы года,132,5,77262
47,23508018,,1545461791,https://ria.ru/20181222/1548461051.html,В Киеве 1 января планируют провести марш в честь дня рождения Бандеры,297,15,58937
48,23507939,Одна из основных воздушных гаваней британской столицы в течение двух последних дней работала с большими перебоями. Инцидент нарушил планы более сотни тысяч человек.,1545460706,https://ria.ru/20181222/1548459115.html,В Лондоне задержали подозреваемых в запуске дронов над аэропортом Гатвик,42,3,60181
49,23507808,"В Disney рассказали о будущем ""Пиратов Карибского моря"": https://ria.ru/20181222/1548459825.html",1545459303,,,45,2,64809
50,23507661,,1545457699,https://ria.ru/20181222/1548460281.html,Правительство США приостановило работу из-за отсутствия бюджета,100,7,61176
51,23507491,"#РИА_ДеньвИстории 
161 год назад в России вышли первые почтовые марки. Их создали по заказу Почтового департамента. Приобрести двухцветную марку с государственным гербом России в голубом овале на фоне мантии, увенчанной короной, можно было всего за 10 копеек. Тираж первой партии составил 3 миллиона марок. В 2018 году в России выпущено более 70 тематических карточек с марками. На них представлены художественные изображения к Чемпионату мира по футболу, годовщине Курской битвы и другим значимым событиям.",1545455787,,,24,35,71359
52,23507390,,1545454691,https://ria.ru/20181222/1548458371.html,"Немецкие СМИ предупредили о риске повтора ""керченского инцидента"" в Арктике",78,6,57940
53,23507257,,1545453497,https://rsport.ria.ru/20181221/1548388952.html,Чемпионат мира-2018 в России посмотрело более половины населения планеты,66,8,64768
54,23507164,"Большинство комментаторов напомнили Порошенко, что Ан-225 является достижением советского, а не украинского авиастроения. При этом некоторые пользователи предложили ""декоммунизировать"" самолет, произведенный в СССР фактически в единственном экземпляре.",1545452416,https://ria.ru/20181222/1548458755.html,"В Сети высмеяли Порошенко за празднование юбилея ""украинского"" Ан-225",117,8,67863
55,23507057,,1545451120,https://rsport.ria.ru/20181221/1548440492.html,Рылов победил на стометровке на спине на Кубке Сальникова,12,8,59988
56,23506932,,1545449600,https://ria.ru/20181221/1548421411.html,"В Минсельхозе подсчитали, во сколько россиянам обойдется новогодний стол",112,7,62011
57,23506836,,1545448105,https://ria.ru/20181222/1548456924.html,В Европе планируют отказаться от Sukhoi Superjet,137,7,61201
58,23506755,,1545446630,https://ria.ru/20181222/1548457587.html,"Источник рассказал о будущих пусках ракет ""Союз"" с космодрома Куру",25,4,57832
59,23506667,,1545445264,https://ria.ru/20181222/1548459077.html,В Вашингтоне мужчина залез на рождественскую ель перед Белым домом,66,5,60448
60,23506610,,1545443888,https://ria.ru/20181221/1548453183.html,ВМС Ирана запустили ракеты около американского авианосца,59,7,57871
61,23506524,,1545442212,https://ria.ru/20181222/1548457906.html,США выделят Украине $10 миллионов после инцидента в Керченском проливе,149,4,58792
62,23506458,Совфед одобрил закон о запрете производства и оборота порошкового вина: https://ria.ru/20181221/1548394639.html,1545440684,,,134,18,75232
63,23506386,,1545439137,https://ria.ru/20181222/1548457262.html,"В США заявили о превосходстве ""Арматы"" над танками НАТО",191,7,59014
64,23506297,,1545437505,https://ria.ru/20181221/1548392916.html,Совфед одобрил закон об ответственном обращении с животными,64,19,58532
65,23506239,,1545435966,https://ria.ru/20181221/1548418360.html,Сын британского миллионера сделал фото в падающем самолете перед смертью,39,3,54496
66,23506159,,1545434347,https://ria.ru/20181222/1548456590.html,Разведка США обвинила Россию и Китай во вмешательстве в выборы-2018,108,3,59937
67,23506060,,1545432815,https://rsport.ria.ru/20181221/1548437817.html,Колесников установил юниорский мировой рекорд на стометровке вольным стилем,16,6,57941
68,23505972,,1545431666,https://ria.ru/20181221/1548452891.html,"Британские СМИ испугались ""разборок"" с российским фрегатом в Азовском море",76,6,56204
69,23505816,"Йети самые. Ученые окончательно раскрыли тайну снежного 
человека: https://ria.ru/20181221/1548340922.html",1545429436,,,62,7,63379
70,23505645,,1545427740,https://ria.ru/20181221/1548399681.html,В Барнауле полицейский пытался скормить задержанному телефон,81,6,57779
71,23505460,,1545426277,https://ria.ru/20181221/1548418240.html,"Большинство украинцев считают свою жизнь невыносимой, показал опрос",414,8,61688
72,23505296,,1545425063,https://ria.ru/20181221/1548440871.html,"В небе над Калифорнией заметили странные огни, похожие на НЛО",88,10,59282
73,23505066,,1545423493,https://ria.ru/20181221/1548452460.html,Курс доллара превысил 69 рублей впервые с сентября,224,12,64832
74,23504871,,1545422312,https://rsport.ria.ru/20181221/1548452614.html,Синицина и Кацалапов победили в танцах на льду на чемпионате России,17,11,60074
75,23504768,"На видео, размещенном в соцсетях, видно, что в палате на полу вокруг разбросанных кусков ваты лежит мужчина. Автор ролика за кадром сообщает, что это пациент Усть-Катавской медсанчасти, которого доставили из Челябинска после проведенной операции - трепанации черепа.",1545421498,https://ria.ru/20181221/1548439187.html,"Врачи объяснили, почему пациент уральской больницы лежал на полу",128,11,62496
76,23504425,,1545419725,https://ria.ru/20181221/1548445969.html,Сотовые операторы предупредили о повышении тарифов,200,20,67436
77,23504262,"Из-за чего возникает зависимость от смартфона: напоминалки, будильники, мессенджеры, онлайн банки, навигация в городе? Как понять, что зависимость есть: нервничаешь, постоянно отвлекаешься на уведомления, иногда чувствуешь ""фантомную"" вибрацию, пишешь человеку, находящемуся в соседнем помещении? Какие могут быть последствия: садится зрение, изолируешься от друзей и семьи, ""серфишь"" перед сном и не высыпаешься? Как с этим всем быть, есть ли на самом деле зависимость от смартфона, или это выдуманная проблема? 
Обсуждаем все это в новом эпизоде подкаста ""ЯсноПонятно"".
#яснопонятно #риа_подкаст",1545418810,,,76,64,100037
78,23504211,,1545418508,https://ria.ru/20181221/1548448874.html,В США зачатые в один день близнецы родились с разницей в 15 лет,61,4,60982
79,23504009,Образцы уже доставлены в лабораторию на Земле.,1545417230,https://ria.ru/20181221/1548411274.html,Российские ученые напечатали в космосе 12 органов,133,11,67459
80,23503837,,1545416160,https://rsport.ria.ru/20181221/1548445493.html,Тарасова прокомментировала неудачное выступление Медведевой в короткой программе,169,3,65907
81,23503606,,1545414684,https://ria.ru/20181221/1548446560.html,Трое российских пилотов погибли в результате крушения Ан-26 в ДР Конго,44,6,61018
82,23503534,,1545414319,,,82,57,82530
83,23503314,"В 2018 году Марк Цукерберг обеднел сильнее всех из представленных в рейтинге миллиардеров. Его состояние уменьшилось на 18,7 миллиарда долларов.",1545413184,https://ria.ru/20181221/1548438096.html,Цукерберг возглавил рейтинг миллиардеров-неудачников по версии Forbes,169,10,68201
84,23503083,"#РИА_Видео
Дед Мороз и Йоулупукки встретились на границе России и Финляндии. Такие встречи — добрая традиция. Они проводятся ежегодно на протяжении почти 30 лет 🎅🎄",1545411696,,,72,14,67262
85,23503003,,1545411321,https://rsport.ria.ru/20181221/1548444812.html,Ковтун одержал победу в мужском одиночном катании на чемпионате России ,55,8,63576
86,23502899,,1545410830,https://ria.ru/20181221/1548427952.html,ГИБДД не планирует вводить повторный экзамен при замене прав,95,6,64421
87,23502777,"Большая пресс-конференция президента, новогодний кадетский бал и подводный Санта-Клаус: самые яркие и эмоциональные фотографии недели — в нашей подборке https://ria.ru/20181221/1548354434.html",1545410232,,,34,5,61218
88,23502565,,1545409331,,,300,55,74573
89,23502453,,1545408773,https://ria.ru/20181221/1548438651.html,Евросоюз продлил экономические санкции против России,221,8,62230
90,23502285,"#РИА_Видео
Ofcom сообщил, что RT нарушил правила вещания в семи новостных программах, ""не сохранив должную беспристрастность"". К примеру, одна из претензий связана с отсутствием ""альтернативной точки зрения"" в сообщении канала о конкурсе детского рисунка в честь дивизии СС ""Галичина"". ""Я не назову это даже бредом. Потому что для такой страны как Великобритания, для страны, которая вместе с нами воевала с фашистами, это вообще просто неприлично"", - сказала Симоньян: https://ria.ru/20181221/1548416564.html",1545407859,,,61,11,62873
